
Subject,Module,Subtopic,DotPoint,Stage,SourceURL,SourceVersionDate,Topic
Mathematics Standard,Algebra,MS‑A1 Formulae and Equations,review substitution of numerical values into linear and non‑linear algebraic expressions and equations,Year 11,https://c.educationstandards.nsw.edu.au/wps/wcm/connect/b828bedf-5193-441f-aa3b-acb726ea2322/mathematics-standard-year-11-content-prior-to-maintenance-detailed-in-official-notice-nesa-48-19.pdf,2017,
Mathematics Standard,Algebra,MS‑A1 Formulae and Equations,"change the subject of a linear formula and solve problems involving formulae, including calculating distance, speed and time or stopping distances using a suitable formula",Year 11,https://c.educationstandards.nsw.edu.au/wps/wcm/connect/b828bedf-5193-441f-aa3b-acb726ea2322/mathematics-standard-year-11-content-prior-to-maintenance-detailed-in-official-notice-nesa-48-19.pdf,2017,
Mathematics Standard,Algebra,MS‑A1 Formulae and Equations,develop and solve linear equations derived from substituting values into a formula or from a word description,Year 11,https://c.educationstandards.nsw.edu.au/wps/wcm/connect/b828bedf-5193-441f-aa3b-acb726ea2322/mathematics-standard-year-11-content-prior-to-maintenance-detailed-in-official-notice-nesa-48-19.pdf,2017,
Mathematics Standard,Algebra,MS‑A1 Formulae and Equations,calculate and interpret blood alcohol content (BAC) using appropriate formulae; determine time required to reach zero BAC and describe limitations of BAC estimation methods,Year 11,https://c.educationstandards.nsw.edu.au/wps/wcm/connect/b828bedf-5193-441f-aa3b-acb726ea2322/mathematics-standard-year-11-content-prior-to-maintenance-detailed-in-official-notice-nesa-48-19.pdf,2017,
Mathematics Standard,Algebra,MS‑A1 Formulae and Equations,"calculate required medication dosages for children and adults using Fried’s, Young’s and Clark’s formulae",Year 11,https://c.educationstandards.nsw.edu.au/wps/wcm/connect/b828bedf-5193-441f-aa3b-acb726ea2322/mathematics-standard-year-11-content-prior-to-maintenance-detailed-in-official-notice-nesa-48-19.pdf,2017,
Mathematics Standard,Algebra,MS‑A2 Linear Relationships,"model, analyse and solve problems involving linear relationships, construct straight‑line graphs and interpret gradient and intercepts; recognise direct variation relationships and interpret the linear function y = mx + b",Year 11,https://c.educationstandards.nsw.edu.au/wps/wcm/connect/b828bedf-5193-441f-aa3b-acb726ea2322/mathematics-standard-year-11-content-prior-to-maintenance-detailed-in-official-notice-nesa-48-19.pdf,2017,
Mathematics Standard,Algebra,MS‑A2 Linear Relationships,"construct and analyse linear models graphically or algebraically to solve practical direct‑variation problems, such as fuel‑cost or currency‑conversion graphs, and evaluate model limitations",Year 11,https://c.educationstandards.nsw.edu.au/wps/wcm/connect/b828bedf-5193-441f-aa3b-acb726ea2322/mathematics-standard-year-11-content-prior-to-maintenance-detailed-in-official-notice-nesa-48-19.pdf,2017,
Mathematics Standard,Measurement,MS‑M1 Applications of Measurement,"review use of metric units (including units of area) and convert between units (e.g., kilometres to metres or litres to millilitres); calculate absolute and percentage error and state limits of accuracy",Year 11,https://c.educationstandards.nsw.edu.au/wps/wcm/connect/b828bedf-5193-441f-aa3b-acb726ea2322/mathematics-standard-year-11-content-prior-to-maintenance-detailed-in-official-notice-nesa-48-19.pdf,2017,
Mathematics Standard,Measurement,MS‑M1 Applications of Measurement,"use standard form and metric prefixes in measurement contexts; review solving perimeter and area problems for triangles, rectangles, parallelograms, trapezia, circles, sectors and composite shapes; apply Pythagoras’ theorem and scale factors to find lengths",Year 11,https://c.educationstandards.nsw.edu.au/wps/wcm/connect/b828bedf-5193-441f-aa3b-acb726ea2322/mathematics-standard-year-11-content-prior-to-maintenance-detailed-in-official-notice-nesa-48-19.pdf,2017,
Mathematics Standard,Measurement,MS‑M1 Applications of Measurement,"solve problems involving surface area and volume of prisms, cylinders, spheres, pyramids and composite solids; convert between units of volume and capacity and use the Trapezoidal rule to estimate areas and volumes",Year 11,https://c.educationstandards.nsw.edu.au/wps/wcm/connect/b828bedf-5193-441f-aa3b-acb726ea2322/mathematics-standard-year-11-content-prior-to-maintenance-detailed-in-official-notice-nesa-48-19.pdf,2017,
Mathematics Standard,Measurement,MS‑M1 Applications of Measurement,"review metric units of mass (grams, kilograms, tonnes) and energy (calories, kilojoules) and use them to solve problems related to food, nutrition, physical activity and electricity consumption",Year 11,https://c.educationstandards.nsw.edu.au/wps/wcm/connect/b828bedf-5193-441f-aa3b-acb726ea2322/mathematics-standard-year-11-content-prior-to-maintenance-detailed-in-official-notice-nesa-48-19.pdf,2017,
Mathematics Standard,Measurement,MS‑M2 Working with Time,"locate positions on Earth using latitude, longitude and GPS; calculate times and time differences around the world, convert between 12‑hour and 24‑hour clocks, and solve problems involving time zones and daylight saving",Year 11,https://c.educationstandards.nsw.edu.au/wps/wcm/connect/b828bedf-5193-441f-aa3b-acb726ea2322/mathematics-standard-year-11-content-prior-to-maintenance-detailed-in-official-notice-nesa-48-19.pdf,2017,
Mathematics Standard,Measurement,MS‑M2 Working with Time,"interpret timetables for buses, trains and ferries; solve practical problems involving travel and communications across different time zones, including Coordinated Universal Time and the International Date Line",Year 11,https://c.educationstandards.nsw.edu.au/wps/wcm/connect/b828bedf-5193-441f-aa3b-acb726ea2322/mathematics-standard-year-11-content-prior-to-maintenance-detailed-in-official-notice-nesa-48-19.pdf,2017,
Mathematics Standard,Financial Mathematics,MS‑F1 Money Matters,"calculate simple interest for different rates and periods and apply percentage increase or decrease to contexts such as GST, profit or loss; graph simple interest using technology",Year 11,https://c.educationstandards.nsw.edu.au/wps/wcm/connect/b828bedf-5193-441f-aa3b-acb726ea2322/mathematics-standard-year-11-content-prior-to-maintenance-detailed-in-official-notice-nesa-48-19.pdf,2017,
Mathematics Standard,Financial Mathematics,MS‑F1 Money Matters,calculate depreciation of an asset using the straight‑line method (Vt = V0 − Dn) and use spreadsheets to calculate and graph compound interest as a recurrence relation,Year 11,https://c.educationstandards.nsw.edu.au/wps/wcm/connect/b828bedf-5193-441f-aa3b-acb726ea2322/mathematics-standard-year-11-content-prior-to-maintenance-detailed-in-official-notice-nesa-48-19.pdf,2017,
Mathematics Standard,Financial Mathematics,MS‑F1 Money Matters,"calculate pay rates from a given salary, including hourly rates, penalty rates, overtime, commissions, piecework and royalties; calculate annual leave loading and government allowances",Year 11,https://c.educationstandards.nsw.edu.au/wps/wcm/connect/b828bedf-5193-441f-aa3b-acb726ea2322/mathematics-standard-year-11-content-prior-to-maintenance-detailed-in-official-notice-nesa-48-19.pdf,2017,
Mathematics Standard,Financial Mathematics,MS‑F1 Money Matters,"calculate income tax and related deductions: identify allowable deductions, determine taxable income, calculate Medicare levy, net pay and Pay As You Go tax using current tax scales",Year 11,https://c.educationstandards.nsw.edu.au/wps/wcm/connect/b828bedf-5193-441f-aa3b-acb726ea2322/mathematics-standard-year-11-content-prior-to-maintenance-detailed-in-official-notice-nesa-48-19.pdf,2017,
Mathematics Standard,Financial Mathematics,MS‑F1 Money Matters,"interpret household bills for electricity, water or gas; plan the purchase of a car by comparing on‑road costs, considering sustainability and using spreadsheets to compare options",Year 11,https://c.educationstandards.nsw.edu.au/wps/wcm/connect/b828bedf-5193-441f-aa3b-acb726ea2322/mathematics-standard-year-11-content-prior-to-maintenance-detailed-in-official-notice-nesa-48-19.pdf,2017,
Mathematics Standard,Financial Mathematics,MS‑F1 Money Matters,"plan for running and maintenance of a car: describe types of insurance, investigate running costs (servicing, repairs, tyres) and compare costs using spreadsheets",Year 11,https://c.educationstandards.nsw.edu.au/wps/wcm/connect/b828bedf-5193-441f-aa3b-acb726ea2322/mathematics-standard-year-11-content-prior-to-maintenance-detailed-in-official-notice-nesa-48-19.pdf,2017,
Mathematics Standard,Financial Mathematics,MS‑F1 Money Matters,"prepare a personal budget for a given income, accounting for fixed and discretionary spending",Year 11,https://c.educationstandards.nsw.edu.au/wps/wcm/connect/b828bedf-5193-441f-aa3b-acb726ea2322/mathematics-standard-year-11-content-prior-to-maintenance-detailed-in-official-notice-nesa-48-19.pdf,2017,
Mathematics Standard,Statistical Analysis,MS‑S1 Data Analysis,"describe and use appropriate data collection methods for populations and samples; investigate sampling methods (systematic, self‑selected, simple random, stratified) and discuss advantages and disadvantages",Year 11,https://c.educationstandards.nsw.edu.au/wps/wcm/connect/b828bedf-5193-441f-aa3b-acb726ea2322/mathematics-standard-year-11-content-prior-to-maintenance-detailed-in-official-notice-nesa-48-19.pdf,2017,
Mathematics Standard,Statistical Analysis,MS‑S1 Data Analysis,"classify data types: categorical variables as ordinal or nominal and numerical variables as discrete or continuous; organise and display data using tables, bar/Pareto charts, histograms, cumulative frequency graphs, dot plots and stem‑and‑leaf plots",Year 11,https://c.educationstandards.nsw.edu.au/wps/wcm/connect/b828bedf-5193-441f-aa3b-acb726ea2322/mathematics-standard-year-11-content-prior-to-maintenance-detailed-in-official-notice-nesa-48-19.pdf,2017,
Mathematics Standard,Statistical Analysis,MS‑S1 Data Analysis,"construct and interpret tables and graphs in real‑world contexts (e.g., motor‑vehicle safety, blood‑alcohol content, running costs, rainfall, temperature, water usage); interpret and compare data by choosing appropriate representations and evaluating their suitability",Year 11,https://c.educationstandards.nsw.edu.au/wps/wcm/connect/b828bedf-5193-441f-aa3b-acb726ea2322/mathematics-standard-year-11-content-prior-to-maintenance-detailed-in-official-notice-nesa-48-19.pdf,2017,
Mathematics Standard,Statistical Analysis,MS‑S1 Data Analysis,"describe distinguishing features of a population and a sample; define symbols for population parameters (µ, σ) and sample statistics (x̄, s); summarise and interpret data using measures of central tendency (mode, mean, median) and measures of spread (range, quantiles, IQR, standard deviation)",Year 11,https://c.educationstandards.nsw.edu.au/wps/wcm/connect/b828bedf-5193-441f-aa3b-acb726ea2322/mathematics-standard-year-11-content-prior-to-maintenance-detailed-in-official-notice-nesa-48-19.pdf,2017,
Mathematics Standard,Statistical Analysis,MS‑S1 Data Analysis,"investigate the effects of outliers on summary statistics and use criteria such as 1.5×IQR to identify outliers; interpret and compare distributions (modality, shape, central tendency, spread, outliers) and construct/interpret parallel box‑plots to compare groups",Year 11,https://c.educationstandards.nsw.edu.au/wps/wcm/connect/b828bedf-5193-441f-aa3b-acb726ea2322/mathematics-standard-year-11-content-prior-to-maintenance-detailed-in-official-notice-nesa-48-19.pdf,2017,
Mathematics Standard,Statistical Analysis,MS‑S2 Relative Frequency and Probability,review and use the language of probability and relative frequency; construct sample spaces and determine the number of outcomes; understand probability scale 0 ≤ P(E) ≤ 1 and calculate probabilities of simple events and their complements,Year 11,https://c.educationstandards.nsw.edu.au/wps/wcm/connect/b828bedf-5193-441f-aa3b-acb726ea2322/mathematics-standard-year-11-content-prior-to-maintenance-detailed-in-official-notice-nesa-48-19.pdf,2017,
Mathematics Standard,Statistical Analysis,MS‑S2 Relative Frequency and Probability,use arrays and tree diagrams to determine outcomes and probabilities for multistage experiments; construct and use tree diagrams to solve two‑stage event problems,Year 11,https://c.educationstandards.nsw.edu.au/wps/wcm/connect/b828bedf-5193-441f-aa3b-acb726ea2322/mathematics-standard-year-11-content-prior-to-maintenance-detailed-in-official-notice-nesa-48-19.pdf,2017,
Mathematics Standard,Statistical Analysis,MS‑S2 Relative Frequency and Probability,perform simulations of experiments using technology; use relative frequency as an estimate of probability; recognise that increasing trials yields relative frequencies approaching theoretical probability and identify factors complicating simulation,Year 11,https://c.educationstandards.nsw.edu.au/wps/wcm/connect/b828bedf-5193-441f-aa3b-acb726ea2322/mathematics-standard-year-11-content-prior-to-maintenance-detailed-in-official-notice-nesa-48-19.pdf,2017,
Mathematics Standard,Statistical Analysis,MS‑S2 Relative Frequency and Probability,solve probability problems and calculate expected frequencies in contexts by using known probabilities or estimates based on relative frequencies,Year 11,https://c.educationstandards.nsw.edu.au/wps/wcm/connect/b828bedf-5193-441f-aa3b-acb726ea2322/mathematics-standard-year-11-content-prior-to-maintenance-detailed-in-official-notice-nesa-48-19.pdf,2017,
Mathematics Advanced,,,"application of knowledge, understanding, skills, values and attitudes in the fields of study they",,Maths Advanced Syllabus.pdf,2019,
Mathematics Advanced,,,"capacity to manage their own learning and to become flexible, independent thinkers, problemsolvers and decision-makers",,Maths Advanced Syllabus.pdf,2019,
Mathematics Advanced,,,capacity to work collaboratively with others,,Maths Advanced Syllabus.pdf,2019,
Mathematics Advanced,,,respect for the cultural diversity of Australian society,,Maths Advanced Syllabus.pdf,2019,
Mathematics Advanced,,,desire to continue learning in formal or informal settings after school,,Maths Advanced Syllabus.pdf,2019,
Mathematics Advanced,,,"further academic study, vocational training and employment",,Maths Advanced Syllabus.pdf,2019,
Mathematics Advanced,,,"changing workplaces, including an increasingly STEM-focused (Science, Technology,",,Maths Advanced Syllabus.pdf,2019,
Mathematics Advanced,,,full and active participation as global citizens,,Maths Advanced Syllabus.pdf,2019,
Mathematics Advanced,Functions,Working with Functions,"define a relation as any set of ordered pairs (𝑥, 𝑦) of real numbers",,Maths Advanced Syllabus.pdf,2019,Functions
Mathematics Advanced,Functions,Working with Functions,"understand the formal definition of a function as a set of ordered pairs (𝑥, 𝑦) of real numbers",,Maths Advanced Syllabus.pdf,2019,Functions
Mathematics Advanced,Functions,Working with Functions,"understand and use interval notation as a way of representing domain and range, eg [4, ∞)",,Maths Advanced Syllabus.pdf,2019,Functions
Mathematics Advanced,Functions,Working with Functions,"know what is meant by one-to-one, one-to-many, many-to-one and many-to-many",,Maths Advanced Syllabus.pdf,2019,Functions
Mathematics Advanced,Functions,Working with Functions,use the vertical line test to identify a function,,Maths Advanced Syllabus.pdf,2019,Functions
Mathematics Advanced,Functions,Working with Functions,determine if a function is one-to-one (ACMSM094),,Maths Advanced Syllabus.pdf,2019,Functions
Mathematics Advanced,Functions,Working with Functions,identify the domain and range of a composite function,,Maths Advanced Syllabus.pdf,2019,Functions
Mathematics Advanced,Functions,Working with Functions,recognise that a direct variation relationship produces a straight-line graph,,Maths Advanced Syllabus.pdf,2019,Functions
Mathematics Advanced,Functions,Working with Functions,explain the geometrical significance of 𝑚 and 𝑐 in the equation 𝑓(𝑥) = 𝑚𝑥 + 𝑐,,Maths Advanced Syllabus.pdf,2019,Functions
Mathematics Advanced,Functions,Working with Functions,"derive the equation of a straight line passing through a fixed point (𝑥1 , 𝑦1 ) and having a given",,Maths Advanced Syllabus.pdf,2019,Functions
Mathematics Advanced,Functions,Working with Functions,"derive the equation of a straight line passing through two points (𝑥1 , 𝑦1 ) and (𝑥2 , 𝑦2 ) by first",,Maths Advanced Syllabus.pdf,2019,Functions
Mathematics Advanced,Functions,Working with Functions,,,Maths Advanced Syllabus.pdf,2019,Functions
Mathematics Advanced,Functions,Working with Functions,"find the equations of straight lines, including parallel and perpendicular lines, given sufficient",,Maths Advanced Syllabus.pdf,2019,Functions
Mathematics Advanced,Functions,Working with Functions,"recognise features of the graph of a quadratic, including its parabolic nature, turning point,",,Maths Advanced Syllabus.pdf,2019,Functions
Mathematics Advanced,Functions,Working with Functions,"find the vertex and intercepts of a quadratic graph by either factorising, completing the square",,Maths Advanced Syllabus.pdf,2019,Functions
Mathematics Advanced,Functions,Working with Functions,understand the role of the discriminant in relation to the position of the graph,,Maths Advanced Syllabus.pdf,2019,Functions
Mathematics Advanced,Functions,Working with Functions,find the equation of a quadratic given sufficient information (ACMMM009),,Maths Advanced Syllabus.pdf,2019,Functions
Mathematics Advanced,Functions,Working with Functions,understand that solving 𝑓(𝑥) = 𝑘 corresponds to finding the values of 𝑥 for which the graph,,Maths Advanced Syllabus.pdf,2019,Functions
Mathematics Advanced,Functions,Working with Functions,recognise the shape and features of the graph of 𝑦 = |𝑎𝑥 + 𝑏| and hence sketch the graph,,Maths Advanced Syllabus.pdf,2019,Functions
Mathematics Advanced,Functions,Working with Functions,"derive the equation of a circle, centre the origin, by considering Pythagoras’ theorem and",,Maths Advanced Syllabus.pdf,2019,Functions
Mathematics Advanced,Functions,Working with Functions,transform equations of the form 𝑥 2 + 𝑦 2 + 𝑎𝑥 + 𝑏𝑦 + 𝑐 = 0 into the form,,Maths Advanced Syllabus.pdf,2019,Functions
Mathematics Advanced,Functions,Working with Functions,sketch circles given their equations and find the equation of a circle from its graph,,Maths Advanced Syllabus.pdf,2019,Functions
Mathematics Advanced,Functions,Working with Functions,,,Maths Advanced Syllabus.pdf,2019,Functions
Mathematics Advanced,Trigonometric Functions,Trigonometry and Measure of Angles,use technology and/or geometric construction to investigate the ambiguous case of the sine,,Maths Advanced Syllabus.pdf,2019,Trigonometric Functions
Mathematics Advanced,Trigonometric Functions,Trigonometry and Measure of Angles,interpret information about a two or three-dimensional context given in diagrammatic or,,Maths Advanced Syllabus.pdf,2019,Trigonometric Functions
Mathematics Advanced,Trigonometric Functions,Trigonometry and Measure of Angles,sketch the trigonometric functions in degrees for 0° ≤ 𝑥 ≤ 360°,,Maths Advanced Syllabus.pdf,2019,Trigonometric Functions
Mathematics Advanced,Trigonometric Functions,Trigonometry and Measure of Angles,"convert between the two measures, using the fact that 360° = 2𝜋 radians",,Maths Advanced Syllabus.pdf,2019,Trigonometric Functions
Mathematics Advanced,Trigonometric Functions,Trigonometry and Measure of Angles,"recognise and use the exact values of sin 𝜃, cos 𝜃 and tan 𝜃 in both degrees and radians for",,Maths Advanced Syllabus.pdf,2019,Trigonometric Functions
Mathematics Advanced,Trigonometric Functions,Trigonometric Functions and Identities,,,Maths Advanced Syllabus.pdf,2019,Trigonometric Functions
Mathematics Advanced,Trigonometric Functions,Trigonometric Functions and Identities,,,Maths Advanced Syllabus.pdf,2019,Trigonometric Functions
Mathematics Advanced,Trigonometric Functions,Trigonometric Functions and Identities,,,Maths Advanced Syllabus.pdf,2019,Trigonometric Functions
Mathematics Advanced,Trigonometric Functions,Trigonometric Functions and Identities,know the difference between an equation and an identity,,Maths Advanced Syllabus.pdf,2019,Trigonometric Functions
Mathematics Advanced,Calculus,Introduction to Differentiation,sketch graphs of functions that are continuous and compare them with graphs of functions,,Maths Advanced Syllabus.pdf,2019,Calculus
Mathematics Advanced,Calculus,Introduction to Differentiation,"describe continuity informally, and identify continuous functions from their graphs",,Maths Advanced Syllabus.pdf,2019,Calculus
Mathematics Advanced,Calculus,Introduction to Differentiation,"establish that 𝑓 ′ (𝑥) = 0 at a stationary point, 𝑓 ′ (𝑥) > 0 when the function is increasing and",,Maths Advanced Syllabus.pdf,2019,Calculus
Mathematics Advanced,Calculus,Introduction to Differentiation,identify families of curves with the same derivative function (ACMMM121),,Maths Advanced Syllabus.pdf,2019,Calculus
Mathematics Advanced,Calculus,Introduction to Differentiation,use technology to plot functions and their gradient functions,,Maths Advanced Syllabus.pdf,2019,Calculus
Mathematics Advanced,Calculus,Introduction to Differentiation,examine examples of variable rates of change of non-linear functions (ACMMM087),,Maths Advanced Syllabus.pdf,2019,Calculus
Mathematics Advanced,Calculus,Introduction to Differentiation,"apply the product rule: If ℎ(𝑥) = 𝑓(𝑥) 𝑔(𝑥) then ℎ′(𝑥) = 𝑓(𝑥) 𝑔′(𝑥) + 𝑓′(𝑥) 𝑔(𝑥), or if 𝑢 and 𝑣",,Maths Advanced Syllabus.pdf,2019,Calculus
Mathematics Advanced,Calculus,Introduction to Differentiation,apply the quotient rule: If ℎ(𝑥) =,,Maths Advanced Syllabus.pdf,2019,Calculus
Mathematics Advanced,Calculus,Introduction to Differentiation,"apply the chain rule: If ℎ(𝑥) = 𝑓(𝑔(𝑥)) then ℎ′(𝑥) = 𝑓′(𝑔(𝑥)) 𝑔′(𝑥), or if 𝑦 is a function of 𝑢 and",,Maths Advanced Syllabus.pdf,2019,Calculus
Mathematics Advanced,Exponential and Logarithmic Functions,Logarithms and Exponentials,"understand and use the fact that log 𝑎 𝑎 𝑥 = 𝑥 for all real 𝑥, and 𝑎log𝑎 𝑥 = 𝑥 for all 𝑥 > 0",,Maths Advanced Syllabus.pdf,2019,Exponential and Logarithmic Functions
Mathematics Advanced,Exponential and Logarithmic Functions,Logarithms and Exponentials,,,Maths Advanced Syllabus.pdf,2019,Exponential and Logarithmic Functions
Mathematics Advanced,Exponential and Logarithmic Functions,Logarithms and Exponentials,define the natural logarithm ln 𝑥 = log 𝑒 𝑥 from the exponential function 𝑓(𝑥) = 𝑒 𝑥,,Maths Advanced Syllabus.pdf,2019,Exponential and Logarithmic Functions
Mathematics Advanced,Exponential and Logarithmic Functions,Logarithms and Exponentials,recognise and use the inverse relationship of the functions 𝑦 = 𝑒 𝑥 and 𝑦 = ln 𝑥 (ACMMM160),,Maths Advanced Syllabus.pdf,2019,Exponential and Logarithmic Functions
Mathematics Advanced,Exponential and Logarithmic Functions,Logarithms and Exponentials,"use the natural logarithm and the relationships 𝑒 ln 𝑥 = 𝑥 where 𝑥 > 0, and ln(𝑒 𝑥 ) = 𝑥 for all",,Maths Advanced Syllabus.pdf,2019,Exponential and Logarithmic Functions
Mathematics Advanced,Exponential and Logarithmic Functions,Logarithms and Exponentials,use the logarithmic laws to simplify and evaluate natural logarithmic expressions and solve,,Maths Advanced Syllabus.pdf,2019,Exponential and Logarithmic Functions
Mathematics Advanced,Exponential and Logarithmic Functions,Logarithms and Exponentials,interpret the meaning of the intercepts of an exponential graph and explain the circumstances,,Maths Advanced Syllabus.pdf,2019,Exponential and Logarithmic Functions
Mathematics Advanced,Exponential and Logarithmic Functions,Logarithms and Exponentials,recognise that the graphs of 𝑦 = 𝑎 𝑥 and 𝑦 = log 𝑎 𝑥 are reflections in the line 𝑦 = 𝑥,,Maths Advanced Syllabus.pdf,2019,Exponential and Logarithmic Functions
Mathematics Advanced,Statistical Analysis,Probability and Discrete Probability Distributions,identify factors that could complicate the simulation of real-world events (ACMEM153),,Maths Advanced Syllabus.pdf,2019,Statistical Analysis
Mathematics Advanced,Statistical Analysis,Probability and Discrete Probability Distributions,use relative frequencies obtained from data as point estimates of probabilities (ACMMM055),,Maths Advanced Syllabus.pdf,2019,Statistical Analysis
Mathematics Advanced,Statistical Analysis,Probability and Discrete Probability Distributions,use everyday occurrences to illustrate set descriptions and representations of events and set,,Maths Advanced Syllabus.pdf,2019,Statistical Analysis
Mathematics Advanced,Statistical Analysis,Probability and Discrete Probability Distributions,know that a random variable describes some aspect in a population from which samples can,,Maths Advanced Syllabus.pdf,2019,Statistical Analysis
Mathematics Advanced,Statistical Analysis,Probability and Discrete Probability Distributions,know the difference between a discrete random variable and a continuous random variable,,Maths Advanced Syllabus.pdf,2019,Statistical Analysis
