
Mathematics Extension 1,Vectors,,the midpoints of the sides of a quadrilateral join to form a parallelogram (ACMSM040),Year 12,Maths Ext. 1 syllabus.pdf,2019,Vectors
Mathematics Extension 1,Vectors,,the sum of the squares of the lengths of the diagonals of a parallelogram is equal to the sum,Year 12,Maths Ext. 1 syllabus.pdf,2019,Vectors
Mathematics Extension 1,Vectors,,the projectile is a point,Year 12,Maths Ext. 1 syllabus.pdf,2019,Vectors
Mathematics Extension 1,Vectors,,the force due to air resistance is negligible,Year 12,Maths Ext. 1 syllabus.pdf,2019,Vectors
Mathematics Extension 1,Vectors,,"the only force acting on the projectile is the constant force due to gravity, assuming that the",Year 12,Maths Ext. 1 syllabus.pdf,2019,Vectors
Mathematics Extension 1,Vectors,,represent the motion of a projectile using vectors,Year 12,Maths Ext. 1 syllabus.pdf,2019,Vectors
Mathematics Extension 1,Vectors,,recognise that the horizontal and vertical components of the motion of a projectile can be,Year 12,Maths Ext. 1 syllabus.pdf,2019,Vectors
Mathematics Extension 1,Vectors,,derive the horizontal and vertical equations of motion of a projectile,Year 12,Maths Ext. 1 syllabus.pdf,2019,Vectors
Mathematics Extension 1,Vectors,,understand and explain the limitations of this projectile model,Year 12,Maths Ext. 1 syllabus.pdf,2019,Vectors
Mathematics Extension 1,Calculus,,change an integrand into an appropriate form using algebra,Year 12,Maths Ext. 1 syllabus.pdf,2019,Calculus
Mathematics Extension 1,Calculus,,form a direction field (slope field) from simple first-order differential equations,Year 12,Maths Ext. 1 syllabus.pdf,2019,Calculus
Mathematics Extension 1,Calculus,,recognise the shape of a direction field from several alternatives given the form of a,Year 12,Maths Ext. 1 syllabus.pdf,2019,Calculus
Mathematics Extension 1,Calculus,,sketch several possible solution curves on a given direction field,Year 12,Maths Ext. 1 syllabus.pdf,2019,Calculus
Mathematics Extension 1,Calculus,,,Year 12,Maths Ext. 1 syllabus.pdf,2019,Calculus
Mathematics Extension 1,Calculus,,,Year 12,Maths Ext. 1 syllabus.pdf,2019,Calculus
Mathematics Extension 1,Calculus,,,Year 12,Maths Ext. 1 syllabus.pdf,2019,Calculus
Mathematics Extension 1,Statistical Analysis,,identify contexts suitable for modelling by Bernoulli random variables (ACMMM144),Year 12,Maths Ext. 1 syllabus.pdf,2019,Statistical Analysis
Mathematics Extension 1,Statistical Analysis,,"understand and apply the formulae for the mean, 𝐸(𝑋) = 𝑥̅ = 𝑝, and variance,",Year 12,Maths Ext. 1 syllabus.pdf,2019,Statistical Analysis
Mathematics Extension 1,Statistical Analysis,,calculate the expected frequencies of the various possible outcomes from a series of,Year 12,Maths Ext. 1 syllabus.pdf,2019,Statistical Analysis
Mathematics Extension 1,Statistical Analysis,,identify contexts suitable for modelling by binomial random variables (ACMMM148),Year 12,Maths Ext. 1 syllabus.pdf,2019,Statistical Analysis
Mathematics Extension 1,Statistical Analysis,,identify the binomial parameter 𝑝 as the probability of success,Year 12,Maths Ext. 1 syllabus.pdf,2019,Statistical Analysis
Mathematics Extension 1,Statistical Analysis,,"understand and use the notation 𝑋~Bin(𝑛, 𝑝) to indicate that the random variable 𝑋 is",Year 12,Maths Ext. 1 syllabus.pdf,2019,Statistical Analysis
Mathematics Extension 1,Statistical Analysis,,apply the formulae for probabilities 𝑃(𝑋 = 𝑟) = 𝑛 𝐶𝑟 𝑝𝑟 (1 − 𝑝)𝑛−𝑟 associated with the binomial,Year 12,Maths Ext. 1 syllabus.pdf,2019,Statistical Analysis
Mathematics Extension 1,Statistical Analysis,,"understand and apply the formulae for the mean, 𝐸(𝑋) = 𝑥̅ = 𝑛𝑝, and the variance,",Year 12,Maths Ext. 1 syllabus.pdf,2019,Statistical Analysis
Mathematics Extension 1,Statistical Analysis,,understand the concept of the sample proportion 𝑝̂ as a random variable whose value varies,Year 12,Maths Ext. 1 syllabus.pdf,2019,Statistical Analysis
Mathematics Extension 1,Statistical Analysis,,examine the approximate normality of the distribution of 𝑝̂ for large samples (ACMMM175),Year 12,Maths Ext. 1 syllabus.pdf,2019,Statistical Analysis
Mathematics Extension 2,,,"application of knowledge, understanding, skills, values and attitudes in the fields of study they",Year 12,Maths Ext. 2 syllabus.pdf,2019,
Mathematics Extension 2,,,"capacity to manage their own learning and to become flexible, independent thinkers, problemsolvers and decision-makers",Year 12,Maths Ext. 2 syllabus.pdf,2019,
Mathematics Extension 2,,,capacity to work collaboratively with others,Year 12,Maths Ext. 2 syllabus.pdf,2019,
Mathematics Extension 2,,,respect for the cultural diversity of Australian society,Year 12,Maths Ext. 2 syllabus.pdf,2019,
Mathematics Extension 2,,,desire to continue learning in formal or informal settings after school,Year 12,Maths Ext. 2 syllabus.pdf,2019,
Mathematics Extension 2,,,"further academic study, vocational training and employment",Year 12,Maths Ext. 2 syllabus.pdf,2019,
Mathematics Extension 2,,,"changing workplaces, including an increasingly STEM-focused (Science, Technology,",Year 12,Maths Ext. 2 syllabus.pdf,2019,
Mathematics Extension 2,,,full and active participation as global citizens,Year 12,Maths Ext. 2 syllabus.pdf,2019,
Mathematics Extension 2,Proof,,"use the symbols for implication (⇒), equivalence (⇔) and equality (=) , demonstrating a",Year 12,Maths Ext. 2 syllabus.pdf,2019,Proof
Mathematics Extension 2,Proof,,"use the phrases ‘for all’ (∀), ‘if and only if’ (iff) and ‘there exists’ (∃) (ACMSM027)",Year 12,Maths Ext. 2 syllabus.pdf,2019,Proof
Mathematics Extension 2,Proof,,understand that a statement is equivalent to its contrapositive but that the converse of a true,Year 12,Maths Ext. 2 syllabus.pdf,2019,Proof
Mathematics Extension 2,Proof,,prove inequalities by using the definition of 𝑎 > 𝑏 for real 𝑎 and 𝑏,Year 12,Maths Ext. 2 syllabus.pdf,2019,Proof
Mathematics Extension 2,Proof,,prove inequalities by using the property that squares of real numbers are non-negative,Year 12,Maths Ext. 2 syllabus.pdf,2019,Proof
Mathematics Extension 2,Proof,,prove and use the triangle inequality |𝑥| + |𝑦| ≥ |𝑥 + 𝑦| and interpret the inequality,Year 12,Maths Ext. 2 syllabus.pdf,2019,Proof
Mathematics Extension 2,Proof,,establish and use the relationship between the arithmetic mean and geometric mean for two,Year 12,Maths Ext. 2 syllabus.pdf,2019,Proof
Mathematics Extension 2,Proof,,"prove inequality results, eg 2𝑛 > 𝑛2 , for positive integers 𝑛 > 4",Year 12,Maths Ext. 2 syllabus.pdf,2019,Proof
Mathematics Extension 2,Proof,,"prove divisibility results, eg 32𝑛+4 − 22𝑛 is divisible by 5 for any positive integer 𝑛",Year 12,Maths Ext. 2 syllabus.pdf,2019,Proof
Mathematics Extension 2,Proof,,,Year 12,Maths Ext. 2 syllabus.pdf,2019,Proof
Mathematics Extension 2,Proof,,,Year 12,Maths Ext. 2 syllabus.pdf,2019,Proof
Mathematics Extension 2,Proof,,,Year 12,Maths Ext. 2 syllabus.pdf,2019,Proof
Mathematics Extension 2,Vectors,,"define the standard unit vectors ~i , j and k~",Year 12,Maths Ext. 2 syllabus.pdf,2019,Vectors
Mathematics Extension 2,Vectors,,,Year 12,Maths Ext. 2 syllabus.pdf,2019,Vectors
Mathematics Extension 2,Vectors,,establish that the magnitude of a vector in three dimensions can be found using:,Year 12,Maths Ext. 2 syllabus.pdf,2019,Vectors
Mathematics Extension 2,Vectors,,,Year 12,Maths Ext. 2 syllabus.pdf,2019,Vectors
Mathematics Extension 2,Vectors,,,Year 12,Maths Ext. 2 syllabus.pdf,2019,Vectors
Mathematics Extension 2,Vectors,,,Year 12,Maths Ext. 2 syllabus.pdf,2019,Vectors
Mathematics Extension 2,Complex Numbers,,"develop an understanding of the classification of numbers and their associated properties,",Year 12,Maths Ext. 2 syllabus.pdf,2019,Complex Numbers
Mathematics Extension 2,Complex Numbers,,"define the number, 𝑖, as a root of the equation 𝑥 2 = −1 (ACMSM067)",Year 12,Maths Ext. 2 syllabus.pdf,2019,Complex Numbers
Mathematics Extension 2,Complex Numbers,,use the symbol 𝑖 to solve quadratic equations that do not have real roots,Year 12,Maths Ext. 2 syllabus.pdf,2019,Complex Numbers
Mathematics Extension 2,Complex Numbers,,"use complex numbers in the form 𝑧 = 𝑎 + 𝑖𝑏, where 𝑎 and 𝑏 are real numbers and 𝑎 is the",Year 12,Maths Ext. 2 syllabus.pdf,2019,Complex Numbers
Mathematics Extension 2,Complex Numbers,,identify the condition for 𝑧1 = 𝑎 + 𝑖𝑏 and 𝑧2 = 𝑐 + 𝑖𝑑 to be equal,Year 12,Maths Ext. 2 syllabus.pdf,2019,Complex Numbers
Mathematics Extension 2,Complex Numbers,,"define and perform complex number addition, subtraction and multiplication (ACMSM070)",Year 12,Maths Ext. 2 syllabus.pdf,2019,Complex Numbers
Mathematics Extension 2,Complex Numbers,,"define, find and use complex conjugates, and denote the complex conjugate of 𝑧 as 𝑧̅",Year 12,Maths Ext. 2 syllabus.pdf,2019,Complex Numbers
Mathematics Extension 2,Complex Numbers,,divide one complex number by another complex number and give the result in the form,Year 12,Maths Ext. 2 syllabus.pdf,2019,Complex Numbers
Mathematics Extension 2,Complex Numbers,,find the reciprocal and two square roots of complex numbers in the form 𝑧 = 𝑎 + 𝑖𝑏,Year 12,Maths Ext. 2 syllabus.pdf,2019,Complex Numbers
Mathematics Extension 2,Complex Numbers,,use the fact that there exists a one-to-one correspondence between the complex number 𝑧 =,Year 12,Maths Ext. 2 syllabus.pdf,2019,Complex Numbers
Mathematics Extension 2,Complex Numbers,,plot the point corresponding to 𝑧 = 𝑎 + 𝑖𝑏,Year 12,Maths Ext. 2 syllabus.pdf,2019,Complex Numbers
Mathematics Extension 2,Complex Numbers,,,Year 12,Maths Ext. 2 syllabus.pdf,2019,Complex Numbers
Mathematics Extension 2,Complex Numbers,,,Year 12,Maths Ext. 2 syllabus.pdf,2019,Complex Numbers
Mathematics Extension 2,Complex Numbers,,,Year 12,Maths Ext. 2 syllabus.pdf,2019,Complex Numbers
Mathematics Extension 2,Complex Numbers,,,Year 12,Maths Ext. 2 syllabus.pdf,2019,Complex Numbers
Mathematics Extension 2,Complex Numbers,,,Year 12,Maths Ext. 2 syllabus.pdf,2019,Complex Numbers
Mathematics Extension 2,Complex Numbers,,,Year 12,Maths Ext. 2 syllabus.pdf,2019,Complex Numbers
Mathematics Extension 2,Complex Numbers,,,Year 12,Maths Ext. 2 syllabus.pdf,2019,Complex Numbers
Mathematics Extension 2,Complex Numbers,,,Year 12,Maths Ext. 2 syllabus.pdf,2019,Complex Numbers
Mathematics Extension 2,Complex Numbers,,,Year 12,Maths Ext. 2 syllabus.pdf,2019,Complex Numbers
Mathematics Extension 2,Complex Numbers,,,Year 12,Maths Ext. 2 syllabus.pdf,2019,Complex Numbers
Mathematics Extension 2,Complex Numbers,,,Year 12,Maths Ext. 2 syllabus.pdf,2019,Complex Numbers
Mathematics Extension 2,Complex Numbers,,,Year 12,Maths Ext. 2 syllabus.pdf,2019,Complex Numbers
Mathematics Extension 2,Complex Numbers,,prove De Moivre’s theorem for integral powers using proof by induction (ACMSM083),Year 12,Maths Ext. 2 syllabus.pdf,2019,Complex Numbers
Mathematics Extension 2,Complex Numbers,,use De Moivre’s theorem to derive trigonometric identities such as,Year 12,Maths Ext. 2 syllabus.pdf,2019,Complex Numbers
Mathematics Extension 2,Complex Numbers,,"given the points representing 𝑧1 and 𝑧2 , find the position of the points representing 𝑧1 + 𝑧2 and",Year 12,Maths Ext. 2 syllabus.pdf,2019,Complex Numbers
Mathematics Extension 2,Complex Numbers,,describe the vector representing 𝑧1 + 𝑧2 or 𝑧1 − 𝑧2 as corresponding to the relevant diagonal,Year 12,Maths Ext. 2 syllabus.pdf,2019,Complex Numbers
Mathematics Extension 2,Calculus,,"develop the method for integration by parts, expressed as ∫ 𝑢𝑣′𝑑𝑥 = 𝑢𝑣 − ∫ 𝑣𝑢′𝑑𝑥 or",Year 12,Maths Ext. 2 syllabus.pdf,2019,Calculus
Mathematics Extension 2,Mechanics,,establish that simple harmonic motion is modelled by equations of the form:,Year 12,Maths Ext. 2 syllabus.pdf,2019,Mechanics
Mathematics Extension 2,Mechanics,,,Year 12,Maths Ext. 2 syllabus.pdf,2019,Mechanics
Mathematics Extension 2,Mechanics,,"use 𝐹 = 𝑚𝑥̈ where 𝐹 is the force acting on a mass, 𝑚, with acceleration 𝑥̈",Year 12,Maths Ext. 2 syllabus.pdf,2019,Mechanics
Mathematics Extension 2,Mechanics,,"interpret graphs of displacement-time and velocity-time to describe the motion of a particle,",Year 12,Maths Ext. 2 syllabus.pdf,2019,Mechanics
Mathematics Extension 2,Mechanics,,"derive, from Newton’s laws of motion, the equation of motion of a particle moving in a single",Year 12,Maths Ext. 2 syllabus.pdf,2019,Mechanics
Mathematics Extension 2,Mechanics,,derive an expression for velocity as a function of time,Year 12,Maths Ext. 2 syllabus.pdf,2019,Mechanics
Mathematics Extension 2,Mechanics,,derive an expression for velocity as a function of displacement,Year 12,Maths Ext. 2 syllabus.pdf,2019,Mechanics
Mathematics Extension 2,Mechanics,,derive an expression for displacement as a function of time,Year 12,Maths Ext. 2 syllabus.pdf,2019,Mechanics
Mathematics Extension 2,Mechanics,,solve problems involving resisted motion along a horizontal line,Year 12,Maths Ext. 2 syllabus.pdf,2019,Mechanics
Mathematics Extension 2,Mechanics,,"derive, from Newton’s laws of motion, the equation of motion of a particle moving vertically in",Year 12,Maths Ext. 2 syllabus.pdf,2019,Mechanics
Mathematics Extension 2,Mechanics,,derive an expression for velocity as a function of time and for velocity as a function of,Year 12,Maths Ext. 2 syllabus.pdf,2019,Mechanics
Mathematics Extension 2,Mechanics,,derive an expression for displacement as a function of time,Year 12,Maths Ext. 2 syllabus.pdf,2019,Mechanics
Mathematics Extension 2,Mechanics,,determine the terminal velocity of a falling particle from its equation of motion,Year 12,Maths Ext. 2 syllabus.pdf,2019,Mechanics
Mathematics Extension 2,Mechanics,,"solve problems by using the expressions derived for acceleration, velocity and displacement",Year 12,Maths Ext. 2 syllabus.pdf,2019,Mechanics
Mathematics Extension 2,Mechanics,,use parametric equations of a projectile to determine a corresponding Cartesian equation for,Year 12,Maths Ext. 2 syllabus.pdf,2019,Mechanics
Mathematics Extension 2,Mechanics,,"use the Cartesian equation of the trajectory of a projectile, including problems in which the",Year 12,Maths Ext. 2 syllabus.pdf,2019,Mechanics
Physics,,,"application of knowledge, understanding, skills, values and attitudes in the fields of study they",Year 12,physics-stage-6-syllabus-2017.pdf,2018,
Physics,,,"capacity to manage their own learning and to become flexible, independent thinkers, problemsolvers and decision-makers",Year 12,physics-stage-6-syllabus-2017.pdf,2018,
Physics,,,capacity to work collaboratively with others,Year 12,physics-stage-6-syllabus-2017.pdf,2018,
Physics,,,respect for the cultural diversity of Australian society,Year 12,physics-stage-6-syllabus-2017.pdf,2018,
Physics,,,desire to continue learning in formal or informal settings after school,Year 12,physics-stage-6-syllabus-2017.pdf,2018,
Physics,,,"further academic study, vocational training and employment",Year 12,physics-stage-6-syllabus-2017.pdf,2018,
Physics,,,"changing workplaces, including an increasingly STEM-focused (Science, Technology,",Year 12,physics-stage-6-syllabus-2017.pdf,2018,
Physics,,,full and active participation as global citizens,Year 12,physics-stage-6-syllabus-2017.pdf,2018,
Physics,,,qualitative descriptions,Year 12,physics-stage-6-syllabus-2017.pdf,2018,
Physics,,,the use of scalar and vector quantities (ACSPH060),Year 12,physics-stage-6-syllabus-2017.pdf,2018,
Physics,,,"quantitative, first-hand measurements",Year 12,physics-stage-6-syllabus-2017.pdf,2018,
Physics,,,the graphical representation and interpretation of data (ACSPH061),Year 12,physics-stage-6-syllabus-2017.pdf,2018,
Physics,,,time,Year 12,physics-stage-6-syllabus-2017.pdf,2018,
Physics,,,distance,Year 12,physics-stage-6-syllabus-2017.pdf,2018,
Physics,,,displacement,Year 12,physics-stage-6-syllabus-2017.pdf,2018,
Physics,,,speed,Year 12,physics-stage-6-syllabus-2017.pdf,2018,
Physics,,,velocity,Year 12,physics-stage-6-syllabus-2017.pdf,2018,
Physics,,,acceleration,Year 12,physics-stage-6-syllabus-2017.pdf,2018,
Physics,,,,Year 12,physics-stage-6-syllabus-2017.pdf,2018,
Physics,,,,Year 12,physics-stage-6-syllabus-2017.pdf,2018,
Physics,,,,Year 12,physics-stage-6-syllabus-2017.pdf,2018,
Physics,,,resolve a vector into two perpendicular components,Year 12,physics-stage-6-syllabus-2017.pdf,2018,
Physics,,,add two perpendicular vector components to obtain a single vector (ACSPH061),Year 12,physics-stage-6-syllabus-2017.pdf,2018,
Physics,,,vector addition,Year 12,physics-stage-6-syllabus-2017.pdf,2018,
Physics,,,resolution of components of vectors (ACSPH060),Year 12,physics-stage-6-syllabus-2017.pdf,2018,
Physics,,,velocity,Year 12,physics-stage-6-syllabus-2017.pdf,2018,
Physics,,,"displacement (ACSPH060, ACSPH061)",Year 12,physics-stage-6-syllabus-2017.pdf,2018,
Physics,,,a boat on a flowing river relative to the bank,Year 12,physics-stage-6-syllabus-2017.pdf,2018,
Physics,,,two moving cars,Year 12,physics-stage-6-syllabus-2017.pdf,2018,
Physics,,,"an aeroplane in a crosswind relative to the ground (ACSPH060, ACSPH132)",Year 12,physics-stage-6-syllabus-2017.pdf,2018,
Physics,,,a contact force,Year 12,physics-stage-6-syllabus-2017.pdf,2018,
Physics,,,a force mediated by fields,Year 12,physics-stage-6-syllabus-2017.pdf,2018,
Physics,,,algebraic addition,Year 12,physics-stage-6-syllabus-2017.pdf,2018,
Physics,,,vector addition,Year 12,physics-stage-6-syllabus-2017.pdf,2018,
Physics,,,vector addition by resolution into components,Year 12,physics-stage-6-syllabus-2017.pdf,2018,
Physics,,,,Year 12,physics-stage-6-syllabus-2017.pdf,2018,
Physics,,,,Year 12,physics-stage-6-syllabus-2017.pdf,2018,
Physics,,,qualitative descriptions,Year 12,physics-stage-6-syllabus-2017.pdf,2018,
Physics,,,graphs and vectors,Year 12,physics-stage-6-syllabus-2017.pdf,2018,
Physics,,,work done and change in the kinetic energy of an object undergoing accelerated rectilinear,Year 12,physics-stage-6-syllabus-2017.pdf,2018,
Physics,,,,Year 12,physics-stage-6-syllabus-2017.pdf,2018,
Physics,,,changes in gravitational potential energy of an object in a uniform field Δ𝑈 = 𝑚𝑔Δℎ,Year 12,physics-stage-6-syllabus-2017.pdf,2018,
Physics,,,uniformly accelerated rectilinear motion,Year 12,physics-stage-6-syllabus-2017.pdf,2018,
Physics,,,objects raised against the force of gravity,Year 12,physics-stage-6-syllabus-2017.pdf,2018,
Physics,,,"work done against air resistance, rolling resistance and friction",Year 12,physics-stage-6-syllabus-2017.pdf,2018,
Physics,,,the role of the medium in the propagation of mechanical waves,Year 12,physics-stage-6-syllabus-2017.pdf,2018,
Physics,,,"the transfer of energy involved in the propagation of mechanical waves (ACSPH067,",Year 12,physics-stage-6-syllabus-2017.pdf,2018,
Physics,,,transverse and longitudinal waves (ACSPH068),Year 12,physics-stage-6-syllabus-2017.pdf,2018,
Physics,,,"mechanical and electromagnetic waves (ACSPH070, ACSPH074)",Year 12,physics-stage-6-syllabus-2017.pdf,2018,
Physics,,,velocity,Year 12,physics-stage-6-syllabus-2017.pdf,2018,
Physics,,,frequency,Year 12,physics-stage-6-syllabus-2017.pdf,2018,
Physics,,,period,Year 12,physics-stage-6-syllabus-2017.pdf,2018,
Physics,,,wavelength,Year 12,physics-stage-6-syllabus-2017.pdf,2018,
Physics,,,displacement and amplitude (ACSPH069),Year 12,physics-stage-6-syllabus-2017.pdf,2018,
Physics,,,,Year 12,physics-stage-6-syllabus-2017.pdf,2018,
Physics,,,,Year 12,physics-stage-6-syllabus-2017.pdf,2018,
Physics,,,reflection,Year 12,physics-stage-6-syllabus-2017.pdf,2018,
Physics,,,refraction,Year 12,physics-stage-6-syllabus-2017.pdf,2018,
Physics,,,diffraction,Year 12,physics-stage-6-syllabus-2017.pdf,2018,
Physics,,,"wave superposition (ACSPH071, ACSPH072)",Year 12,physics-stage-6-syllabus-2017.pdf,2018,
Physics,,,driving frequency,Year 12,physics-stage-6-syllabus-2017.pdf,2018,
Physics,,,natural frequency of the oscillating system,Year 12,physics-stage-6-syllabus-2017.pdf,2018,
Physics,,,amplitude of motion,Year 12,physics-stage-6-syllabus-2017.pdf,2018,
Physics,,,transfer/transformation of energy within the system (ACSPH073),Year 12,physics-stage-6-syllabus-2017.pdf,2018,
Physics,,,,Year 12,physics-stage-6-syllabus-2017.pdf,2018,
Physics,,,,Year 12,physics-stage-6-syllabus-2017.pdf,2018,
Physics,,,,Year 12,physics-stage-6-syllabus-2017.pdf,2018,
Physics,,,,Year 12,physics-stage-6-syllabus-2017.pdf,2018,
Physics,,,,Year 12,physics-stage-6-syllabus-2017.pdf,2018,
Physics,,,,Year 12,physics-stage-6-syllabus-2017.pdf,2018,
Physics,,,conduction,Year 12,physics-stage-6-syllabus-2017.pdf,2018,
Physics,,,convection,Year 12,physics-stage-6-syllabus-2017.pdf,2018,
Physics,,,radiation (ACSPH016),Year 12,physics-stage-6-syllabus-2017.pdf,2018,
Physics,,,,Year 12,physics-stage-6-syllabus-2017.pdf,2018,
Physics,,,,Year 12,physics-stage-6-syllabus-2017.pdf,2018,
Physics,,,processes by which objects become electrically charged (ACSPH002),Year 12,physics-stage-6-syllabus-2017.pdf,2018,
Physics,,,the forces produced by other objects as a result of their interactions with charged objects,Year 12,physics-stage-6-syllabus-2017.pdf,2018,
Physics,,,variables that affect electrostatic forces between those objects (ACSPH103),Year 12,physics-stage-6-syllabus-2017.pdf,2018,
Physics,,,simple point charges,Year 12,physics-stage-6-syllabus-2017.pdf,2018,
Physics,,,pairs of charges,Year 12,physics-stage-6-syllabus-2017.pdf,2018,
Physics,,,dipoles,Year 12,physics-stage-6-syllabus-2017.pdf,2018,
Physics,,,parallel charged plates,Year 12,physics-stage-6-syllabus-2017.pdf,2018,
Physics,,,,Year 12,physics-stage-6-syllabus-2017.pdf,2018,
Physics,,,,Year 12,physics-stage-6-syllabus-2017.pdf,2018,
Physics,,,,Year 12,physics-stage-6-syllabus-2017.pdf,2018,
Physics,,,,Year 12,physics-stage-6-syllabus-2017.pdf,2018,
Physics,,,,Year 12,physics-stage-6-syllabus-2017.pdf,2018,
Physics,,,,Year 12,physics-stage-6-syllabus-2017.pdf,2018,
Physics,,,,Year 12,physics-stage-6-syllabus-2017.pdf,2018,
Physics,,,,Year 12,physics-stage-6-syllabus-2017.pdf,2018,
Physics,,,,Year 12,physics-stage-6-syllabus-2017.pdf,2018,
Physics,,,,Year 12,physics-stage-6-syllabus-2017.pdf,2018,
Physics,,,,Year 12,physics-stage-6-syllabus-2017.pdf,2018,
Physics,,,,Year 12,physics-stage-6-syllabus-2017.pdf,2018,
Physics,,,,Year 12,physics-stage-6-syllabus-2017.pdf,2018,
Physics,,,a constant vertical acceleration due to gravity,Year 12,physics-stage-6-syllabus-2017.pdf,2018,
Physics,,,zero air resistance,Year 12,physics-stage-6-syllabus-2017.pdf,2018,
Physics,,,initial velocity,Year 12,physics-stage-6-syllabus-2017.pdf,2018,
Physics,,,launch angle,Year 12,physics-stage-6-syllabus-2017.pdf,2018,
Physics,,,maximum height,Year 12,physics-stage-6-syllabus-2017.pdf,2018,
Physics,,,time of flight,Year 12,physics-stage-6-syllabus-2017.pdf,2018,
Physics,,,final velocity,Year 12,physics-stage-6-syllabus-2017.pdf,2018,
Physics,,,launch height,Year 12,physics-stage-6-syllabus-2017.pdf,2018,
Physics,,,horizontal range of the projectile (ACSPH099),Year 12,physics-stage-6-syllabus-2017.pdf,2018,
Physics,,,centripetal force,Year 12,physics-stage-6-syllabus-2017.pdf,2018,
Physics,,,mass,Year 12,physics-stage-6-syllabus-2017.pdf,2018,
Physics,,,speed,Year 12,physics-stage-6-syllabus-2017.pdf,2018,
Physics,,,radius,Year 12,physics-stage-6-syllabus-2017.pdf,2018,
Physics,,,cars moving around horizontal circular bends,Year 12,physics-stage-6-syllabus-2017.pdf,2018,
Physics,,,a mass on a string,Year 12,physics-stage-6-syllabus-2017.pdf,2018,
Physics,,,objects on banked tracks (ACSPH100),Year 12,physics-stage-6-syllabus-2017.pdf,2018,
Physics,,,,Year 12,physics-stage-6-syllabus-2017.pdf,2018,
Physics,,,,Year 12,physics-stage-6-syllabus-2017.pdf,2018,
Physics,,,,Year 12,physics-stage-6-syllabus-2017.pdf,2018,
Physics,,,,Year 12,physics-stage-6-syllabus-2017.pdf,2018,
Physics,,,,Year 12,physics-stage-6-syllabus-2017.pdf,2018,
Physics,,,,Year 12,physics-stage-6-syllabus-2017.pdf,2018,
Physics,,,,Year 12,physics-stage-6-syllabus-2017.pdf,2018,
Physics,,,,Year 12,physics-stage-6-syllabus-2017.pdf,2018,
Physics,,,gravitational force,Year 12,physics-stage-6-syllabus-2017.pdf,2018,
Physics,,,centripetal force,Year 12,physics-stage-6-syllabus-2017.pdf,2018,
Physics,,,centripetal acceleration,Year 12,physics-stage-6-syllabus-2017.pdf,2018,
Physics,,,mass,Year 12,physics-stage-6-syllabus-2017.pdf,2018,
Physics,,,orbital radius,Year 12,physics-stage-6-syllabus-2017.pdf,2018,
Physics,,,orbital velocity,Year 12,physics-stage-6-syllabus-2017.pdf,2018,
Physics,,,orbital period,Year 12,physics-stage-6-syllabus-2017.pdf,2018,
Physics,,,,Year 12,physics-stage-6-syllabus-2017.pdf,2018,
Physics,,,,Year 12,physics-stage-6-syllabus-2017.pdf,2018,
Physics,,,,Year 12,physics-stage-6-syllabus-2017.pdf,2018,
Physics,,,,Year 12,physics-stage-6-syllabus-2017.pdf,2018,
Physics,,,,Year 12,physics-stage-6-syllabus-2017.pdf,2018,
Physics,,,,Year 12,physics-stage-6-syllabus-2017.pdf,2018,
Physics,,,,Year 12,physics-stage-6-syllabus-2017.pdf,2018,
Physics,,,,Year 12,physics-stage-6-syllabus-2017.pdf,2018,
Physics,,,,Year 12,physics-stage-6-syllabus-2017.pdf,2018,
Physics,,,,Year 12,physics-stage-6-syllabus-2017.pdf,2018,
Physics,,,"acceleration, perpendicular to the field, of charged particles",Year 12,physics-stage-6-syllabus-2017.pdf,2018,
Physics,,,the force on the charge 𝐹 = 𝑞𝑣⊥ 𝐵 = 𝑞𝑣𝐵sin𝜃,Year 12,physics-stage-6-syllabus-2017.pdf,2018,
Physics,,,the interaction of charged particles with electric fields,Year 12,physics-stage-6-syllabus-2017.pdf,2018,
Physics,,,other examples of uniform circular motion (ACSPH108),Year 12,physics-stage-6-syllabus-2017.pdf,2018,
Physics,,,conditions under which the maximum force is produced,Year 12,physics-stage-6-syllabus-2017.pdf,2018,
