
Engineering Studies,,,learn to: loads and extension,Year 12,engineering-studies-st6-syl-from2013+Engineering+Studies.pdf,2011,
Engineering Studies,,,learn to: load/extension diagram,Year 12,engineering-studies-st6-syl-from2013+Engineering+Studies.pdf,2011,
Engineering Studies,,,learn to: tension and compression,Year 12,engineering-studies-st6-syl-from2013+Engineering+Studies.pdf,2011,
Engineering Studies,,,"learn to: distinguish between extension, stress and",Year 12,engineering-studies-st6-syl-from2013+Engineering+Studies.pdf,2011,
Engineering Studies,,,learn to: stress and strain,Year 12,engineering-studies-st6-syl-from2013+Engineering+Studies.pdf,2011,
Engineering Studies,,,learn about: ,Year 12,engineering-studies-st6-syl-from2013+Engineering+Studies.pdf,2011,
Engineering Studies,,,learn about: ,Year 12,engineering-studies-st6-syl-from2013+Engineering+Studies.pdf,2011,
Engineering Studies,,,"learn to: work, power, energy (without calculations),",Year 12,engineering-studies-st6-syl-from2013+Engineering+Studies.pdf,2011,
Engineering Studies,,,learn to: fluid mechanics,Year 12,engineering-studies-st6-syl-from2013+Engineering+Studies.pdf,2011,
Engineering Studies,,,learn to: Pascal’s principle,Year 12,engineering-studies-st6-syl-from2013+Engineering+Studies.pdf,2011,
Engineering Studies,,,learn to: hydrostatic pressure,Year 12,engineering-studies-st6-syl-from2013+Engineering+Studies.pdf,2011,
Engineering Studies,,,learn to: applications to braking systems,Year 12,engineering-studies-st6-syl-from2013+Engineering+Studies.pdf,2011,
Engineering Studies,,,learn to: investigate and apply the basic principles of,Year 12,engineering-studies-st6-syl-from2013+Engineering+Studies.pdf,2011,
Engineering Studies,,,learn to: materials for braking systems,Year 12,engineering-studies-st6-syl-from2013+Engineering+Studies.pdf,2011,
Engineering Studies,,,learn to: steels,Year 12,engineering-studies-st6-syl-from2013+Engineering+Studies.pdf,2011,
Engineering Studies,,,learn to: cast irons,Year 12,engineering-studies-st6-syl-from2013+Engineering+Studies.pdf,2011,
Engineering Studies,,,learn to: composites,Year 12,engineering-studies-st6-syl-from2013+Engineering+Studies.pdf,2011,
Engineering Studies,,,learn to: manufacturing/forming processes of,Year 12,engineering-studies-st6-syl-from2013+Engineering+Studies.pdf,2011,
Engineering Studies,,,learn to: investigate the macrostructure and,Year 12,engineering-studies-st6-syl-from2013+Engineering+Studies.pdf,2011,
Engineering Studies,,,learn to: testing of materials,Year 12,engineering-studies-st6-syl-from2013+Engineering+Studies.pdf,2011,
Engineering Studies,,,learn to: tensile and compression test,Year 12,engineering-studies-st6-syl-from2013+Engineering+Studies.pdf,2011,
Engineering Studies,,,learn to: hardness test,Year 12,engineering-studies-st6-syl-from2013+Engineering+Studies.pdf,2011,
Engineering Studies,,,learn to: describe and/or conduct relevant mechanical,Year 12,engineering-studies-st6-syl-from2013+Engineering+Studies.pdf,2011,
Engineering Studies,,,learn to: describe the manufacturing processes and,Year 12,engineering-studies-st6-syl-from2013+Engineering+Studies.pdf,2011,
Engineering Studies,,,learn to: graphical mechanics; graphical solutions to simple,Year 12,engineering-studies-st6-syl-from2013+Engineering+Studies.pdf,2011,
Engineering Studies,,,learn to: use of graphics to solve engineering,Year 12,engineering-studies-st6-syl-from2013+Engineering+Studies.pdf,2011,
Engineering Studies,,,"learn to: pictorial, orthogonal and exploded drawings",Year 12,engineering-studies-st6-syl-from2013+Engineering+Studies.pdf,2011,
Engineering Studies,,,learn to: produce pictorial and assembled orthogonal,Year 12,engineering-studies-st6-syl-from2013+Engineering+Studies.pdf,2011,
Engineering Studies,,,"learn to: Australian Standard (AS 1100), including",Year 12,engineering-studies-st6-syl-from2013+Engineering+Studies.pdf,2011,
Engineering Studies,,,"learn to: computer graphics, computer aided drawing",Year 12,engineering-studies-st6-syl-from2013+Engineering+Studies.pdf,2011,
Engineering Studies,,,learn to: use appropriate application software to,Year 12,engineering-studies-st6-syl-from2013+Engineering+Studies.pdf,2011,
Engineering Studies,,,learn to: collaborative work practices,Year 12,engineering-studies-st6-syl-from2013+Engineering+Studies.pdf,2011,
Engineering Studies,,,learn to: work with others and identify the benefits of,Year 12,engineering-studies-st6-syl-from2013+Engineering+Studies.pdf,2011,
Engineering Studies,,,learn to: Engineering Report writing,Year 12,engineering-studies-st6-syl-from2013+Engineering+Studies.pdf,2011,
Engineering Studies,,,learn to: complete an Engineering Report based on,Year 12,engineering-studies-st6-syl-from2013+Engineering+Studies.pdf,2011,
Engineering Studies,(Cad),,learn to: nature and range of the work of biomedical,Year 12,engineering-studies-st6-syl-from2013+Engineering+Studies.pdf,2011,(Cad)
Engineering Studies,(Cad),,learn to: conduct research on the nature and range of the,Year 12,engineering-studies-st6-syl-from2013+Engineering+Studies.pdf,2011,(Cad)
Engineering Studies,(Cad),,learn to: current projects and innovations,Year 12,engineering-studies-st6-syl-from2013+Engineering+Studies.pdf,2011,(Cad)
Engineering Studies,(Cad),,learn to: identify the health and safety issues relevant to,Year 12,engineering-studies-st6-syl-from2013+Engineering+Studies.pdf,2011,(Cad)
Engineering Studies,(Cad),,learn to: health and safety matters,Year 12,engineering-studies-st6-syl-from2013+Engineering+Studies.pdf,2011,(Cad)
Engineering Studies,(Cad),,learn to: appraise the training requirements and career,Year 12,engineering-studies-st6-syl-from2013+Engineering+Studies.pdf,2011,(Cad)
Engineering Studies,(Cad),,learn to: training for the profession,Year 12,engineering-studies-st6-syl-from2013+Engineering+Studies.pdf,2011,(Cad)
Engineering Studies,(Cad),,learn to: career prospects,Year 12,engineering-studies-st6-syl-from2013+Engineering+Studies.pdf,2011,(Cad)
Engineering Studies,(Cad),,learn to: debate social and ethical issues relating to,Year 12,engineering-studies-st6-syl-from2013+Engineering+Studies.pdf,2011,(Cad)
Engineering Studies,(Cad),,learn to: relations with the community,Year 12,engineering-studies-st6-syl-from2013+Engineering+Studies.pdf,2011,(Cad)
Engineering Studies,(Cad),,learn to: technologies unique to the profession,Year 12,engineering-studies-st6-syl-from2013+Engineering+Studies.pdf,2011,(Cad)
Engineering Studies,(Cad),,learn to: ethics and engineering,Year 12,engineering-studies-st6-syl-from2013+Engineering+Studies.pdf,2011,(Cad)
Engineering Studies,(Cad),,learn to: engineers as managers,Year 12,engineering-studies-st6-syl-from2013+Engineering+Studies.pdf,2011,(Cad)
Engineering Studies,(Cad),,learn to: discuss and relate the historic development of,Year 12,engineering-studies-st6-syl-from2013+Engineering+Studies.pdf,2011,(Cad)
Engineering Studies,(Cad),,learn to: historical background to biomedical,Year 12,engineering-studies-st6-syl-from2013+Engineering+Studies.pdf,2011,(Cad)
Engineering Studies,(Cad),,learn to: historical developments of products,Year 12,engineering-studies-st6-syl-from2013+Engineering+Studies.pdf,2011,(Cad)
Engineering Studies,(Cad),,learn to: discuss the impact of biomedical engineering on,Year 12,engineering-studies-st6-syl-from2013+Engineering+Studies.pdf,2011,(Cad)
Engineering Studies,(Cad),,learn to: the effect of biomedical engineering on,Year 12,engineering-studies-st6-syl-from2013+Engineering+Studies.pdf,2011,(Cad)
Engineering Studies,(Cad),,learn to: apply mathematical and/or graphical methods to,Year 12,engineering-studies-st6-syl-from2013+Engineering+Studies.pdf,2011,(Cad)
Engineering Studies,(Cad),,learn to: orders of levers,Year 12,engineering-studies-st6-syl-from2013+Engineering+Studies.pdf,2011,(Cad)
Engineering Studies,(Cad),,"learn to: mechanical advantage, velocity ratio and",Year 12,engineering-studies-st6-syl-from2013+Engineering+Studies.pdf,2011,(Cad)
Engineering Studies,(Cad),,learn to: forming methods,Year 12,engineering-studies-st6-syl-from2013+Engineering+Studies.pdf,2011,(Cad)
Engineering Studies,(Cad),,learn to: forging,Year 12,engineering-studies-st6-syl-from2013+Engineering+Studies.pdf,2011,(Cad)
Engineering Studies,(Cad),,learn to: casting,Year 12,engineering-studies-st6-syl-from2013+Engineering+Studies.pdf,2011,(Cad)
Engineering Studies,(Cad),,learn to: cutting,Year 12,engineering-studies-st6-syl-from2013+Engineering+Studies.pdf,2011,(Cad)
Engineering Studies,(Cad),,learn to: joining,Year 12,engineering-studies-st6-syl-from2013+Engineering+Studies.pdf,2011,(Cad)
Engineering Studies,(Cad),,learn to: describe forming processes for materials used in,Year 12,engineering-studies-st6-syl-from2013+Engineering+Studies.pdf,2011,(Cad)
Engineering Studies,(Cad),,learn to: discuss emerging technologies used in,Year 12,engineering-studies-st6-syl-from2013+Engineering+Studies.pdf,2011,(Cad)
Engineering Studies,(Cad),,learn to: compare the macrostructure and properties of,Year 12,engineering-studies-st6-syl-from2013+Engineering+Studies.pdf,2011,(Cad)
Engineering Studies,(Cad),,learn to: structure and properties of appropriate materials,Year 12,engineering-studies-st6-syl-from2013+Engineering+Studies.pdf,2011,(Cad)
Engineering Studies,(Cad),,"learn to: alloy steels such as stainless steel, titanium",Year 12,engineering-studies-st6-syl-from2013+Engineering+Studies.pdf,2011,(Cad)
Engineering Studies,(Cad),,learn to: polymers,Year 12,engineering-studies-st6-syl-from2013+Engineering+Studies.pdf,2011,(Cad)
Engineering Studies,(Cad),,learn to: ceramics,Year 12,engineering-studies-st6-syl-from2013+Engineering+Studies.pdf,2011,(Cad)
Engineering Studies,(Cad),,learn to: explain the properties and uses of appropriate,Year 12,engineering-studies-st6-syl-from2013+Engineering+Studies.pdf,2011,(Cad)
Engineering Studies,(Cad),,learn to: Ohm’s Law,Year 12,engineering-studies-st6-syl-from2013+Engineering+Studies.pdf,2011,(Cad)
Engineering Studies,(Cad),,learn to: apply Ohm’s Law and explain the basic,Year 12,engineering-studies-st6-syl-from2013+Engineering+Studies.pdf,2011,(Cad)
Engineering Studies,(Cad),,learn to: series and parallel circuits,Year 12,engineering-studies-st6-syl-from2013+Engineering+Studies.pdf,2011,(Cad)
Engineering Studies,(Cad),,learn to: discuss the development of electronic,Year 12,engineering-studies-st6-syl-from2013+Engineering+Studies.pdf,2011,(Cad)
Engineering Studies,(Cad),,learn to: power source,Year 12,engineering-studies-st6-syl-from2013+Engineering+Studies.pdf,2011,(Cad)
Engineering Studies,(Cad),,learn to: microcircuits/integrated circuits,Year 12,engineering-studies-st6-syl-from2013+Engineering+Studies.pdf,2011,(Cad)
Engineering Studies,(Cad),,learn to: explain the advantages of,Year 12,engineering-studies-st6-syl-from2013+Engineering+Studies.pdf,2011,(Cad)
Engineering Studies,(Cad),,learn to: digital technology,Year 12,engineering-studies-st6-syl-from2013+Engineering+Studies.pdf,2011,(Cad)
Engineering Studies,(Cad),,learn to: explain elementary digital logic,Year 12,engineering-studies-st6-syl-from2013+Engineering+Studies.pdf,2011,(Cad)
Engineering Studies,(Cad),,learn to: sectioning of orthogonal drawings,Year 12,engineering-studies-st6-syl-from2013+Engineering+Studies.pdf,2011,(Cad)
Engineering Studies,(Cad),,"learn to: produce dimensioned, sectioned orthogonal",Year 12,engineering-studies-st6-syl-from2013+Engineering+Studies.pdf,2011,(Cad)
Engineering Studies,(Cad),,learn to: Australian Standard (AS 1100),Year 12,engineering-studies-st6-syl-from2013+Engineering+Studies.pdf,2011,(Cad)
Engineering Studies,(Cad),,learn to: dimensioning,Year 12,engineering-studies-st6-syl-from2013+Engineering+Studies.pdf,2011,(Cad)
Engineering Studies,(Cad),,learn to: justify the use of graphics as a communication,Year 12,engineering-studies-st6-syl-from2013+Engineering+Studies.pdf,2011,(Cad)
Engineering Studies,(Cad),,"learn to: computer graphics, CAD",Year 12,engineering-studies-st6-syl-from2013+Engineering+Studies.pdf,2011,(Cad)
Engineering Studies,(Cad),,learn to: graphical design,Year 12,engineering-studies-st6-syl-from2013+Engineering+Studies.pdf,2011,(Cad)
Engineering Studies,(Cad),,learn to: use appropriate application software to produce,Year 12,engineering-studies-st6-syl-from2013+Engineering+Studies.pdf,2011,(Cad)
Engineering Studies,(Cad),,learn to: construct quality graphical solutions,Year 12,engineering-studies-st6-syl-from2013+Engineering+Studies.pdf,2011,(Cad)
Engineering Studies,(Cad),,learn to: collaborative work practices,Year 12,engineering-studies-st6-syl-from2013+Engineering+Studies.pdf,2011,(Cad)
Engineering Studies,(Cad),,learn to: work with others and identify the benefits of,Year 12,engineering-studies-st6-syl-from2013+Engineering+Studies.pdf,2011,(Cad)
Engineering Studies,(Cad),,learn to: Engineering Report writing,Year 12,engineering-studies-st6-syl-from2013+Engineering+Studies.pdf,2011,(Cad)
Engineering Studies,(Cad),,learn to: complete an Engineering Report on the,Year 12,engineering-studies-st6-syl-from2013+Engineering+Studies.pdf,2011,(Cad)
Engineering Studies,(Cad),,learn to: ,Year 12,engineering-studies-st6-syl-from2013+Engineering+Studies.pdf,2011,(Cad)
Engineering Studies,(Cad),,learn to: ,Year 12,engineering-studies-st6-syl-from2013+Engineering+Studies.pdf,2011,(Cad)
Engineering Studies,(Cad),,learn to: ,Year 12,engineering-studies-st6-syl-from2013+Engineering+Studies.pdf,2011,(Cad)
Engineering Studies,(Cad),,learn to: ,Year 12,engineering-studies-st6-syl-from2013+Engineering+Studies.pdf,2011,(Cad)
Engineering Studies,(Cad),,learn to: ,Year 12,engineering-studies-st6-syl-from2013+Engineering+Studies.pdf,2011,(Cad)
Engineering Studies,(Cad),,learn to: ,Year 12,engineering-studies-st6-syl-from2013+Engineering+Studies.pdf,2011,(Cad)
Engineering Studies,(Cad),,learn to: ,Year 12,engineering-studies-st6-syl-from2013+Engineering+Studies.pdf,2011,(Cad)
Engineering Studies,(Cad),,learn to: ,Year 12,engineering-studies-st6-syl-from2013+Engineering+Studies.pdf,2011,(Cad)
Engineering Studies,(Cad),,learn to: ,Year 12,engineering-studies-st6-syl-from2013+Engineering+Studies.pdf,2011,(Cad)
Engineering Studies,(Cad),,learn to: ,Year 12,engineering-studies-st6-syl-from2013+Engineering+Studies.pdf,2011,(Cad)
Engineering Studies,(Cad),,learn to: ,Year 12,engineering-studies-st6-syl-from2013+Engineering+Studies.pdf,2011,(Cad)
Engineering Studies,(Cad),,learn to: ,Year 12,engineering-studies-st6-syl-from2013+Engineering+Studies.pdf,2011,(Cad)
Engineering Studies,(Cad),,learn to: historical developments of civil structures,Year 12,engineering-studies-st6-syl-from2013+Engineering+Studies.pdf,2011,(Cad)
Engineering Studies,(Cad),,learn to: outline the history of technological change as,Year 12,engineering-studies-st6-syl-from2013+Engineering+Studies.pdf,2011,(Cad)
Engineering Studies,(Cad),,learn to: engineering innovation in civil structures and,Year 12,engineering-studies-st6-syl-from2013+Engineering+Studies.pdf,2011,(Cad)
Engineering Studies,(Cad),,learn to: investigate the construction processes and,Year 12,engineering-studies-st6-syl-from2013+Engineering+Studies.pdf,2011,(Cad)
Engineering Studies,(Cad),,learn to: construction and processing materials used in,Year 12,engineering-studies-st6-syl-from2013+Engineering+Studies.pdf,2011,(Cad)
Engineering Studies,(Cad),,learn to: critically examine the impact of civil,Year 12,engineering-studies-st6-syl-from2013+Engineering+Studies.pdf,2011,(Cad)
Engineering Studies,(Cad),,learn to: environmental implications from the use of,Year 12,engineering-studies-st6-syl-from2013+Engineering+Studies.pdf,2011,(Cad)
Engineering Studies,(Cad),,learn to: truss analysis,Year 12,engineering-studies-st6-syl-from2013+Engineering+Studies.pdf,2011,(Cad)
Engineering Studies,(Cad),,learn to: actions (loads),Year 12,engineering-studies-st6-syl-from2013+Engineering+Studies.pdf,2011,(Cad)
Engineering Studies,(Cad),,learn to: reactions,Year 12,engineering-studies-st6-syl-from2013+Engineering+Studies.pdf,2011,(Cad)
Engineering Studies,(Cad),,learn to: pin jointed trusses only,Year 12,engineering-studies-st6-syl-from2013+Engineering+Studies.pdf,2011,(Cad)
Engineering Studies,(Cad),,learn to: method of joints,Year 12,engineering-studies-st6-syl-from2013+Engineering+Studies.pdf,2011,(Cad)
Engineering Studies,(Cad),,learn to: method of sections,Year 12,engineering-studies-st6-syl-from2013+Engineering+Studies.pdf,2011,(Cad)
Engineering Studies,(Cad),,learn to: apply mathematical and/or graphical methods,Year 12,engineering-studies-st6-syl-from2013+Engineering+Studies.pdf,2011,(Cad)
Engineering Studies,(Cad),,learn to: bending stress induced by point loads only,Year 12,engineering-studies-st6-syl-from2013+Engineering+Studies.pdf,2011,(Cad)
Engineering Studies,(Cad),,learn to: concept of shear force and bending moment,Year 12,engineering-studies-st6-syl-from2013+Engineering+Studies.pdf,2011,(Cad)
Engineering Studies,(Cad),,learn to: shear force and bending moment diagrams,Year 12,engineering-studies-st6-syl-from2013+Engineering+Studies.pdf,2011,(Cad)
Engineering Studies,(Cad),,learn to: concept of neutral axis and outer fibre stress,Year 12,engineering-studies-st6-syl-from2013+Engineering+Studies.pdf,2011,(Cad)
Engineering Studies,(Cad),,learn to: bending stress calculation (second moment,Year 12,engineering-studies-st6-syl-from2013+Engineering+Studies.pdf,2011,(Cad)
Engineering Studies,(Cad),,learn to: evaluate the importance of the stress/strain,Year 12,engineering-studies-st6-syl-from2013+Engineering+Studies.pdf,2011,(Cad)
Engineering Studies,(Cad),,learn to: uniformly distributed loads,Year 12,engineering-studies-st6-syl-from2013+Engineering+Studies.pdf,2011,(Cad)
Engineering Studies,(Cad),,learn to: describe the effect of uniformly distributed,Year 12,engineering-studies-st6-syl-from2013+Engineering+Studies.pdf,2011,(Cad)
Engineering Studies,(Cad),,learn to: stress and strain,Year 12,engineering-studies-st6-syl-from2013+Engineering+Studies.pdf,2011,(Cad)
Engineering Studies,(Cad),,"learn to: shear, compressive and tensile stress",Year 12,engineering-studies-st6-syl-from2013+Engineering+Studies.pdf,2011,(Cad)
Engineering Studies,(Cad),,learn to: engineering and true stress,Year 12,engineering-studies-st6-syl-from2013+Engineering+Studies.pdf,2011,(Cad)
Engineering Studies,(Cad),,"learn to: yield stress, proof stress, toughness, Young’s",Year 12,engineering-studies-st6-syl-from2013+Engineering+Studies.pdf,2011,(Cad)
Engineering Studies,(Cad),,learn to: apply mathematical and/or graphical methods,Year 12,engineering-studies-st6-syl-from2013+Engineering+Studies.pdf,2011,(Cad)
Engineering Studies,(Cad),,learn to: ,Year 12,engineering-studies-st6-syl-from2013+Engineering+Studies.pdf,2011,(Cad)
Engineering Studies,(Cad),,learn to: ,Year 12,engineering-studies-st6-syl-from2013+Engineering+Studies.pdf,2011,(Cad)
Engineering Studies,(Cad),,learn to: calculate and graph the bending stress and,Year 12,engineering-studies-st6-syl-from2013+Engineering+Studies.pdf,2011,(Cad)
Engineering Studies,(Cad),,learn to: apply mathematical methods to solve,Year 12,engineering-studies-st6-syl-from2013+Engineering+Studies.pdf,2011,(Cad)
Engineering Studies,(Cad),,learn to: testing of materials,Year 12,engineering-studies-st6-syl-from2013+Engineering+Studies.pdf,2011,(Cad)
Engineering Studies,(Cad),,learn to: specialised testing of engineering materials,Year 12,engineering-studies-st6-syl-from2013+Engineering+Studies.pdf,2011,(Cad)
Engineering Studies,(Cad),,learn to: ,Year 12,engineering-studies-st6-syl-from2013+Engineering+Studies.pdf,2011,(Cad)
Engineering Studies,(Cad),,learn to: describe basic and specialised testing,Year 12,engineering-studies-st6-syl-from2013+Engineering+Studies.pdf,2011,(Cad)
Engineering Studies,(Cad),,"learn to: examine the properties, uses and",Year 12,engineering-studies-st6-syl-from2013+Engineering+Studies.pdf,2011,(Cad)
Engineering Studies,(Cad),,learn to: testing of concrete,Year 12,engineering-studies-st6-syl-from2013+Engineering+Studies.pdf,2011,(Cad)
Engineering Studies,(Cad),,learn to: crack theory,Year 12,engineering-studies-st6-syl-from2013+Engineering+Studies.pdf,2011,(Cad)
Engineering Studies,(Cad),,learn to: crack formation and growth,Year 12,engineering-studies-st6-syl-from2013+Engineering+Studies.pdf,2011,(Cad)
Engineering Studies,(Cad),,learn to: failure due to cracking,Year 12,engineering-studies-st6-syl-from2013+Engineering+Studies.pdf,2011,(Cad)
Engineering Studies,(Cad),,learn to: repair and/or elimination of failure due to,Year 12,engineering-studies-st6-syl-from2013+Engineering+Studies.pdf,2011,(Cad)
Engineering Studies,(Cad),,learn to: examine how failure due to cracking can be,Year 12,engineering-studies-st6-syl-from2013+Engineering+Studies.pdf,2011,(Cad)
Engineering Studies,(Cad),,learn to: ceramics,Year 12,engineering-studies-st6-syl-from2013+Engineering+Studies.pdf,2011,(Cad)
Engineering Studies,(Cad),,learn to: structure/property relationships and their,Year 12,engineering-studies-st6-syl-from2013+Engineering+Studies.pdf,2011,(Cad)
Engineering Studies,(Cad),,learn to: make appropriate choices of materials and,Year 12,engineering-studies-st6-syl-from2013+Engineering+Studies.pdf,2011,(Cad)
Engineering Studies,(Cad),,learn to: ,Year 12,engineering-studies-st6-syl-from2013+Engineering+Studies.pdf,2011,(Cad)
Engineering Studies,(Cad),,learn to: ,Year 12,engineering-studies-st6-syl-from2013+Engineering+Studies.pdf,2011,(Cad)
Engineering Studies,(Cad),,learn to: ,Year 12,engineering-studies-st6-syl-from2013+Engineering+Studies.pdf,2011,(Cad)
Engineering Studies,(Cad),,learn to: investigate the relationship of structure to,Year 12,engineering-studies-st6-syl-from2013+Engineering+Studies.pdf,2011,(Cad)
Engineering Studies,(Cad),,learn to: composites,Year 12,engineering-studies-st6-syl-from2013+Engineering+Studies.pdf,2011,(Cad)
Engineering Studies,(Cad),,learn to: timber,Year 12,engineering-studies-st6-syl-from2013+Engineering+Studies.pdf,2011,(Cad)
Engineering Studies,(Cad),,"learn to: concrete (reinforced, pre- and post-",Year 12,engineering-studies-st6-syl-from2013+Engineering+Studies.pdf,2011,(Cad)
Engineering Studies,(Cad),,learn to: explain the special properties produced by,Year 12,engineering-studies-st6-syl-from2013+Engineering+Studies.pdf,2011,(Cad)
Engineering Studies,(Cad),,learn to: ,Year 12,engineering-studies-st6-syl-from2013+Engineering+Studies.pdf,2011,(Cad)
Engineering Studies,(Cad),,learn to: ,Year 12,engineering-studies-st6-syl-from2013+Engineering+Studies.pdf,2011,(Cad)
Engineering Studies,(Cad),,learn to: ,Year 12,engineering-studies-st6-syl-from2013+Engineering+Studies.pdf,2011,(Cad)
Engineering Studies,(Cad),,"learn to: compare simple reinforced, pre-tensioned and",Year 12,engineering-studies-st6-syl-from2013+Engineering+Studies.pdf,2011,(Cad)
Engineering Studies,(Cad),,learn to: corrosion,Year 12,engineering-studies-st6-syl-from2013+Engineering+Studies.pdf,2011,(Cad)
Engineering Studies,(Cad),,learn to: corrosive environments,Year 12,engineering-studies-st6-syl-from2013+Engineering+Studies.pdf,2011,(Cad)
Engineering Studies,(Cad),,"learn to: dry corrosion, wet corrosion, stress",Year 12,engineering-studies-st6-syl-from2013+Engineering+Studies.pdf,2011,(Cad)
Engineering Studies,(Cad),,learn to: evaluate the significance of corrosion,Year 12,engineering-studies-st6-syl-from2013+Engineering+Studies.pdf,2011,(Cad)
Engineering Studies,(Cad),,learn to: recyclability of materials,Year 12,engineering-studies-st6-syl-from2013+Engineering+Studies.pdf,2011,(Cad)
Engineering Studies,(Cad),,learn to: describe methods used for recycling materials,Year 12,engineering-studies-st6-syl-from2013+Engineering+Studies.pdf,2011,(Cad)
Engineering Studies,(Cad),,learn to: describe methods used to protect civil,Year 12,engineering-studies-st6-syl-from2013+Engineering+Studies.pdf,2011,(Cad)
Engineering Studies,(Cad),,learn to: Australian Standard (AS 1100),Year 12,engineering-studies-st6-syl-from2013+Engineering+Studies.pdf,2011,(Cad)
Engineering Studies,(Cad),,learn to: produce orthogonal assembly dimensioned,Year 12,engineering-studies-st6-syl-from2013+Engineering+Studies.pdf,2011,(Cad)
Engineering Studies,(Cad),,learn to: orthogonal assembly dimensioned drawings,Year 12,engineering-studies-st6-syl-from2013+Engineering+Studies.pdf,2011,(Cad)
Engineering Studies,(Cad),,learn to: freehand pictorial drawings,Year 12,engineering-studies-st6-syl-from2013+Engineering+Studies.pdf,2011,(Cad)
Engineering Studies,(Cad),,learn to: produce freehand pictorial drawings,Year 12,engineering-studies-st6-syl-from2013+Engineering+Studies.pdf,2011,(Cad)
Engineering Studies,(Cad),,learn to: graphical mechanics,Year 12,engineering-studies-st6-syl-from2013+Engineering+Studies.pdf,2011,(Cad)
Engineering Studies,(Cad),,learn to: graphical solutions to engineering problems,Year 12,engineering-studies-st6-syl-from2013+Engineering+Studies.pdf,2011,(Cad)
Engineering Studies,(Cad),,learn to: apply graphical methods to the solutions of,Year 12,engineering-studies-st6-syl-from2013+Engineering+Studies.pdf,2011,(Cad)
Engineering Studies,(Cad),,learn to: computer graphics,Year 12,engineering-studies-st6-syl-from2013+Engineering+Studies.pdf,2011,(Cad)
Engineering Studies,(Cad),,learn to: Computer Aided Drawing (CAD),Year 12,engineering-studies-st6-syl-from2013+Engineering+Studies.pdf,2011,(Cad)
Engineering Studies,(Cad),,learn to: applications for solving problems,Year 12,engineering-studies-st6-syl-from2013+Engineering+Studies.pdf,2011,(Cad)
Engineering Studies,(Cad),,learn to: describe and/or use software to solve problems,Year 12,engineering-studies-st6-syl-from2013+Engineering+Studies.pdf,2011,(Cad)
Engineering Studies,(Cad),,learn to: collaborative work practices,Year 12,engineering-studies-st6-syl-from2013+Engineering+Studies.pdf,2011,(Cad)
